{
  "api_version": 1,
  "os_family": "ubuntu",
  "started_at": "2025-01-15T10:30:00Z",
  "finished_at": null,
  "status": "running",
  "steps": [
    {
      "step": "base.sh",
      "phase": "succeeded",
      "started_at": "2025-01-15T10:30:00Z",
      "ended_at": "2025-01-15T10:31:00Z",
      "exit_code": 0
    },
    {
      "step": "human-user.sh",
      "phase": "running",
      "started_at": "2025-01-15T10:31:01Z",
      "ended_at": null,
      "exit_code": null
    },
    {
      "step": "finish.sh",
      "phase": "pending",
      "started_at": null,
      "ended_at": null,
      "exit_code": null
    }
  ]
}
